Product Brand_x,Product Name_x,Quantity Remaining_x,MRP_x,Weighted Cost Price_x,Minimum Price_x,Weighted Shelf Score_x,Viability Score_x,1-15 Days_x,Together Bought With_x,Similar Products_x,Stock wrt Demand_x
Tide,Detergent,31,28.11,19.973400849395624,20.972070891865407,0.4441806304302408,0.2120685329683072,4,"24 Mantra Organic Dal, Dhara Cooking Oil, Ariel Detergent","Surf Excel Detergent, Ariel Detergent",7.75
Good Knight,Mosquito Repellent,25,121.15,97.06898406374502,101.92243326693227,0.5047333715480172,0.2155384368532799,4,"Mother Dairy Curd, Amul Chocolates, Mother Dairy Milk","All Out Mosquito Repellent, Mortein Mosquito Repellent",6.25
Britannia,Cheese,34,413.01,305.4663372781065,320.73965414201183,0.4896956437359303,0.1903184095245955,5,"Coca-Cola Soft Drinks, Odonil Air Freshener, Gowardhan Paneer","Amul Cheese, Go Cheese",6.8
Head & Shoulders,Shampoo,45,341.62,249.67174257425745,262.15532970297033,0.6382660623087506,0.1668990480138584,8,"Dabur Toothpaste, Gowardhan Paneer, Odonil Air Freshener","Clinic Plus Shampoo, Pantene Shampoo",5.625
B Natural,Fruit Juice,31,424.14,308.1260993589744,323.53240432692314,0.5982962583136667,0.1936176316058562,8,"Madhur Sugar, Dabur Toothpaste, Mother Dairy Butter","Real Fruit Juice, Tropicana Fruit Juice",3.875
